"tweet_id","user_id","username","name","first_name","last_name","full_text","view_count","bookmark_count","favorite_count","reply_count","retweet_count","quote_count","bookmarked","favorited","retweeted","created_at","user_mentions","location","bio","website","websites","can_dm","can_media_tag","is_quote_status","lang","followers_count","following_count","media_count","statuses_count","favourites_count","listed_count","fast_followers_count","normal_followers_count","followed_by","following","profile_banner_url","profile_url","avatar_url","verified","is_blue_verified","user_created_at"
"1780108451190125005","768145142662492160","SHUBHAMTUTEJA4","भावी_प्रधानमंत्री🌈","भावी_प्रधानमंत्री🌈","","@stats_feed Indian state of Bangladesh with sheikh hasina as chief minister","27",0,0,0,0,0,false,false,false,"16/04/2024, 10:38:22","stats_feed","फ्री बिजली पानी वाला शहर","At war with myself.","https://secret.viralsachxd.com/d475e70b2","https://secret.viralsachxd.com/d475e70b2",true,false,false,"en",686,631,244,2145,4303,0,0,686,,false,"https://pbs.twimg.com/profile_banners/768145142662492160/1615033915","https://www.x.com/SHUBHAMTUTEJA4","https://pbs.twimg.com/profile_images/1685669284310355968/0PlR1xrL_normal.jpg",false,false,"23/08/2016, 22:57:28"
"1780107824271638829","1765642535563612161","KDLIVE4455","KD LIVE","KD","LIVE","After Maldives Bangladesh में क्यों लगे Boycott India के नारे ? | Sheikh Hasina on Boycott India

Click here - https://t.co/nBi2Lt0RsZ

#bangladesh #boycott #sheikhhasina #india #Indiaoutcampaign #IranIsraelConflict #GodiMedia #RCBvSRH #देवी_मां_को_ऐसे_करें_प्रसन्न https://t.co/IOynHOYHI2","131",0,1,0,0,0,false,false,false,"16/04/2024, 10:35:52","","Plot No. 2 SSI, Opp Metro Pill","Master Govt. Exams with India's Top Faculty!  Live Classes, Recorded Videos, & Test Series. Download the App & Start Today!","https://www.youtube.com/@KD_LIVE","https://www.youtube.com/@KD_LIVE",false,true,false,"und",18,9,135,142,30,0,0,18,,false,"https://pbs.twimg.com/profile_banners/1765642535563612161/1709799608","https://www.x.com/KDLIVE4455","https://pbs.twimg.com/profile_images/1765653585398763520/jhGXzIBv_normal.jpg",false,false,"07/03/2024, 12:36:29"
"1780089813242384895","61825515","debraj_speaks","Debraj","Debraj","","@KolkataPolice book this hatemonger!! 
Clearly Sheikh Hasina is there on the Billboard!! Trying to pass it as West Bengal!!","31",0,0,0,0,0,false,false,false,"16/04/2024, 09:24:18","KolkataPolice","🇮🇳✋🏼","#Millennial | Avid Reader l RTs ≠ Endorsement","","",false,false,true,"en",2119,1281,3755,69511,86060,310,0,2119,,false,"https://pbs.twimg.com/profile_banners/61825515/1681183166","https://www.x.com/debraj_speaks","https://pbs.twimg.com/profile_images/1779872448982536193/vDfq3G8d_normal.jpg",false,false,"31/07/2009, 23:35:53"
"1780063480697233815","1634472418860470272","NavneetSahay6","Navneet Sahay","Navneet","Sahay","@kanhaiyakumar modi 3 will act like Sheikh hasina in Bangladesh Finish all.oppisition 
This us real threat before india now",0,0,0,0,0,0,false,false,false,"16/04/2024, 07:39:40","kanhaiyakumar","","","","",true,true,false,"en",10,22,7689,8967,6,0,0,10,,false,,"https://www.x.com/NavneetSahay6","https://pbs.twimg.com/profile_images/1634472965638336513/Vt9p4TTS_normal.png",false,false,"11/03/2023, 13:34:56"
"1780038402546762043","414946220","scroll_in","Scroll.in","Scroll.in","","The Opposition in Dhaka is using the India Out campaign to galvanise anger among Bangladeshis against the Sheikh Hasina regime, which is seen as close to New Delhi.

Will it affect India-Bangladesh relations?

Read Abhik Deb's report to know more.
https://t.co/9JgQcwZ3VN","990",0,2,0,1,0,false,false,false,"16/04/2024, 06:00:01","","","The news that matters and the things that make life worth living. Become a Scroll Member today. https://t.co/nJZ81D6Etp","https://scroll.in/contribute","https://scroll.in/contribute
https://scroll.in/",false,true,false,"en",471160,111,173953,549500,232,2148,0,471160,,false,"https://pbs.twimg.com/profile_banners/414946220/1726563452","https://www.x.com/scroll_in","https://pbs.twimg.com/profile_images/1605258806250070016/YGzA42cy_normal.jpg",false,false,"17/11/2011, 23:03:25"